{
  "schema_version": 1,
  "environment": "staging",
  "advisor_cli_version": "2.115.0",
  "expected_count": 73,
  "observed_on": "2026-10-18",
  "entries": [
    {
      "cache_key": "authenticated_security_definer_function_executable_public_activate_waste_policy_v2_p_policy_version_id uuid",
      "rule": "authenticated_security_definer_function_executable",
      "level": "WARN",
      "object": {
        "kind": "function",
        "schema": "public",
        "name": "activate_waste_policy_v2",
        "identity_arguments": "p_policy_version_id uuid",
        "language": "plpgsql",
        "security_definer": true
      },
      "evidence": {
        "kind": "function_execute",
        "anon_execute": false,
        "authenticated_execute": true,
        "service_role_execute": true
      },
      "remediation_url": "https://supabase.com/docs/guides/database/database-linter?lint=0029_authenticated_security_definer_function_executable",
      "disposition": "temporary_open",
      "reason": "public.activate_waste_policy_v2은 현재 authenticated 실행 가능 경계를 정확히 고정하기 위한 임시 공개 항목이며, 함수 내부의 사용자·연구실 권한 검토 전에는 안전하다고 간주하지 않는다.",
      "reviewed_by_role": "internal_security_owner",
      "reviewed_at": "2026-08-24",
      "expires_on": "2026-12-31",
      "target_gate": "관문 2 함수별 권한 검토"
    },
    {
      "cache_key": "authenticated_security_definer_function_executable_public_add_safety_center_request_event_p_request_id uuid, p_body text, p_to_status text",
      "rule": "authenticated_security_definer_function_executable",
      "level": "WARN",
      "object": {
        "kind": "function",
        "schema": "public",
        "name": "add_safety_center_request_event",
        "identity_arguments": "p_request_id uuid, p_body text, p_to_status text",
        "language": "plpgsql",
        "security_definer": true
      },
      "evidence": {
        "kind": "function_execute",
        "anon_execute": false,
        "authenticated_execute": true,
        "service_role_execute": true
      },
      "remediation_url": "https://supabase.com/docs/guides/database/database-linter?lint=0029_authenticated_security_definer_function_executable",
      "disposition": "temporary_open",
      "reason": "public.add_safety_center_request_event은 현재 authenticated 실행 가능 경계를 정확히 고정하기 위한 임시 공개 항목이며, 함수 내부의 사용자·연구실 권한 검토 전에는 안전하다고 간주하지 않는다.",
      "reviewed_by_role": "internal_security_owner",
      "reviewed_at": "2026-08-24",
      "expires_on": "2026-12-31",
      "target_gate": "운영 9 역할·MFA와 함수 권한 검토"
    },
    {
      "cache_key": "authenticated_security_definer_function_executable_public_attach_safety_center_verification_document_p_center_id uuid, p_path text, p_name text, p_mime_type text, p_size bigint",
      "rule": "authenticated_security_definer_function_executable",
      "level": "WARN",
      "object": {
        "kind": "function",
        "schema": "public",
        "name": "attach_safety_center_verification_document",
        "identity_arguments": "p_center_id uuid, p_path text, p_name text, p_mime_type text, p_size bigint",
        "language": "plpgsql",
        "security_definer": true
      },
      "evidence": {
        "kind": "function_execute",
        "anon_execute": false,
        "authenticated_execute": true,
        "service_role_execute": true
      },
      "remediation_url": "https://supabase.com/docs/guides/database/database-linter?lint=0029_authenticated_security_definer_function_executable",
      "disposition": "temporary_open",
      "reason": "public.attach_safety_center_verification_document은 현재 authenticated 실행 가능 경계를 정확히 고정하기 위한 임시 공개 항목이며, 함수 내부의 사용자·연구실 권한 검토 전에는 안전하다고 간주하지 않는다.",
      "reviewed_by_role": "internal_security_owner",
      "reviewed_at": "2026-08-24",
      "expires_on": "2026-12-31",
      "target_gate": "운영 9 역할·MFA와 함수 권한 검토"
    },
    {
      "cache_key": "authenticated_security_definer_function_executable_public_commit_inventory_import_batch_v1_p_job_id uuid, p_revision integer, p_rows jsonb",
      "rule": "authenticated_security_definer_function_executable",
      "level": "WARN",
      "object": {
        "kind": "function",
        "schema": "public",
        "name": "commit_inventory_import_batch_v1",
        "identity_arguments": "p_job_id uuid, p_revision integer, p_rows jsonb",
        "language": "plpgsql",
        "security_definer": true
      },
      "evidence": {
        "kind": "function_execute",
        "anon_execute": false,
        "authenticated_execute": true,
        "service_role_execute": false
      },
      "remediation_url": "https://supabase.com/docs/guides/database/database-linter?lint=0029_authenticated_security_definer_function_executable",
      "disposition": "temporary_open",
      "reason": "가져오기 작업의 개인·연구실 접근과 삭제 작업 상태를 확인하고 작업 행을 잠근다. revision·행별 영수증·100행 한도를 검사한다. authenticated 실행은 기능에 필요하나 SECURITY DEFINER 경고를 해소했다고 보지 않으며 함수별 권한 검토를 계속한다.",
      "reviewed_by_role": "automated_code_review",
      "reviewed_at": "2026-10-02",
      "expires_on": "2026-12-31",
      "target_gate": "캐비넷·재고 가져오기 함수별 권한 검토 및 hosted 회귀 검증"
    },
    {
      "cache_key": "authenticated_security_definer_function_executable_public_create_cabinet_v2_p_name text, p_location text, p_width integer, p_height integer, p_depth integer, p_lab_id uuid",
      "rule": "authenticated_security_definer_function_executable",
      "level": "WARN",
      "object": {
        "kind": "function",
        "schema": "public",
        "name": "create_cabinet_v2",
        "identity_arguments": "p_name text, p_location text, p_width integer, p_height integer, p_depth integer, p_lab_id uuid",
        "language": "plpgsql",
        "security_definer": true
      },
      "evidence": {
        "kind": "function_execute",
        "anon_execute": false,
        "authenticated_execute": true,
        "service_role_execute": false
      },
      "remediation_url": "https://supabase.com/docs/guides/database/database-linter?lint=0029_authenticated_security_definer_function_executable",
      "disposition": "temporary_open",
      "reason": "auth.uid()와 요청 연구실의 membership을 확인하며 사용자 ID를 호출자의 값으로 설정한다. 캐비넷 이름·크기 한도를 검사한다. authenticated 생성 권한은 필요하지만 SECURITY DEFINER 경고는 임시 미해결로 유지한다.",
      "reviewed_by_role": "automated_code_review",
      "reviewed_at": "2026-10-02",
      "expires_on": "2026-12-31",
      "target_gate": "캐비넷·재고 가져오기 함수별 권한 검토 및 hosted 회귀 검증"
    },
    {
      "cache_key": "authenticated_security_definer_function_executable_public_create_inventory_item_atomic_p_name text, p_storage_type text, p_brand text, p_product_number text, p_cas_number text, p_quantity integer, p_capacity text, p_cabinet_id uuid, p_storage_location_id uuid, p_product_id uuid, p_expiry_date date, p_memo text, p_remaining_percent integer, p_lab_id uuid, p_actor_user_id uuid, p_actor_name text",
      "rule": "authenticated_security_definer_function_executable",
      "level": "WARN",
      "object": {
        "kind": "function",
        "schema": "public",
        "name": "create_inventory_item_atomic",
        "identity_arguments": "p_name text, p_storage_type text, p_brand text, p_product_number text, p_cas_number text, p_quantity integer, p_capacity text, p_cabinet_id uuid, p_storage_location_id uuid, p_product_id uuid, p_expiry_date date, p_memo text, p_remaining_percent integer, p_lab_id uuid, p_actor_user_id uuid, p_actor_name text",
        "language": "plpgsql",
        "security_definer": true
      },
      "evidence": {
        "kind": "function_execute",
        "anon_execute": false,
        "authenticated_execute": true,
        "service_role_execute": true
      },
      "remediation_url": "https://supabase.com/docs/guides/database/database-linter?lint=0029_authenticated_security_definer_function_executable",
      "disposition": "temporary_open",
      "reason": "public.create_inventory_item_atomic은 현재 authenticated 실행 가능 경계를 정확히 고정하기 위한 임시 공개 항목이며, 함수 내부의 사용자·연구실 권한 검토 전에는 안전하다고 간주하지 않는다.",
      "reviewed_by_role": "internal_security_owner",
      "reviewed_at": "2026-08-24",
      "expires_on": "2026-12-31",
      "target_gate": "운영 6 기존 RPC 권한 Contract"
    },
    {
      "cache_key": "authenticated_security_definer_function_executable_public_create_inventory_item_with_dates_atomic_p_name text, p_storage_type text, p_brand text, p_product_number text, p_cas_number text, p_quantity integer, p_capacity text, p_cabinet_id uuid, p_storage_location_id uuid, p_product_id uuid, p_expiry_date date, p_manufacturer_date_type text, p_received_date date, p_opened_date date, p_memo text, p_remaining_percent integer, p_lab_id uuid, p_actor_user_id uuid, p_actor_name text",
      "rule": "authenticated_security_definer_function_executable",
      "level": "WARN",
      "object": {
        "kind": "function",
        "schema": "public",
        "name": "create_inventory_item_with_dates_atomic",
        "identity_arguments": "p_name text, p_storage_type text, p_brand text, p_product_number text, p_cas_number text, p_quantity integer, p_capacity text, p_cabinet_id uuid, p_storage_location_id uuid, p_product_id uuid, p_expiry_date date, p_manufacturer_date_type text, p_received_date date, p_opened_date date, p_memo text, p_remaining_percent integer, p_lab_id uuid, p_actor_user_id uuid, p_actor_name text",
        "language": "plpgsql",
        "security_definer": true
      },
      "evidence": {
        "kind": "function_execute",
        "anon_execute": false,
        "authenticated_execute": true,
        "service_role_execute": true
      },
      "remediation_url": "https://supabase.com/docs/guides/database/database-linter?lint=0029_authenticated_security_definer_function_executable",
      "disposition": "temporary_open",
      "reason": "public.create_inventory_item_with_dates_atomic은 현재 authenticated 실행 가능 경계를 정확히 고정하기 위한 임시 공개 항목이며, 함수 내부의 사용자·연구실 권한 검토 전에는 안전하다고 간주하지 않는다.",
      "reviewed_by_role": "internal_security_owner",
      "reviewed_at": "2026-08-24",
      "expires_on": "2026-12-31",